[
  {
    "id": "severstal",
    "kind": "real",
    "name": "ПАО «Северсталь»",
    "aliases": ["Северсталь", "ЧерМК", "Череповецкий металлургический комбинат"],
    "source_note": "Профиль составлен командой по открытым источникам (сайт и отчётность компании, СМИ). Это не официальная позиция компании.",
    "description": "Вертикально интегрированная сталелитейная и горнодобывающая компания. Основной актив — Череповецкий металлургический комбинат (Вологодская область), собственная железная руда в Карелии и Мурманской области. План выпуска стали на 2026 год — около 11,2–11,3 млн т. Продаёт металл строителям, трубникам и машиностроителям, часть продукции идёт на экспорт через порты Северо-Запада.",
    "industry": "Металлургия",
    "subindustries": ["Сталь и прокат", "Железная руда и окатыши", "Трубы большого диаметра"],
    "regions": ["Вологодская область", "Карелия", "Мурманская область", "Ленинградская область"],
    "products": ["Металлопрокат", "Горячекатаный прокат", "Оцинкованный прокат", "Арматура", "Трубы большого диаметра", "Слябы", "Железорудные окатыши"],
    "clients": ["Строительные компании", "Девелоперы", "Трубные заводы", "Машиностроительные предприятия", "Покупатели металла на экспорт"],
    "suppliers": ["РЖД (железнодорожные перевозки)", "Морские порты Северо-Запада", "Коксующийся уголь", "Электроэнергия"],
    "competitors": ["НЛМК", "ММК", "Евраз", "Мечел"],
    "goals": ["Сохранить загрузку мощностей близкой к 100%", "Запустить комплекс по производству окатышей", "Снизить себестоимость и затраты"],
    "priorities": ["Импортозамещение в сегментах металлоконструкций и деталей машин", "Диверсификация логистики экспорта", "Контроль капитальных затрат"],
    "risks": ["Падение внутреннего спроса на сталь", "Ограничения вывоза продукции через порты", "Рост тарифов естественных монополий и логистических затрат", "Высокая ключевая ставка у клиентов-застройщиков"],
    "investment_plans": ["Комплекс по производству железорудных окатышей", "Ремонты и модернизация на ЧерМК"],
    "keywords": ["спрос на сталь", "металлопотребление", "Балтика", "экспорт металла"]
  },
  {
    "id": "x5",
    "kind": "real",
    "name": "X5 Group (ИКС 5)",
    "aliases": ["X5", "ИКС 5", "Пятёрочка", "Перекрёсток", "Чижик"],
    "source_note": "Профиль составлен командой по открытым источникам (сайт и отчётность компании, СМИ). Это не официальная позиция компании.",
    "description": "Крупнейший продуктовый ритейлер России: сети «Пятёрочка», «Перекрёсток», «Чижик», франчайзинговые точки «Около», цифровые сервисы доставки и собственная логистика. На 30 сентября 2026 года под управлением — 30 981 магазин.",
    "industry": "Розничная торговля",
    "subindustries": ["Продуктовый ритейл", "Жёсткие дискаунтеры", "Онлайн-доставка продуктов"],
    "regions": ["Москва", "Санкт-Петербург", "Поволжье", "Урал", "Сибирь", "Юг России"],
    "products": ["Продукты питания", "Напитки и соки", "Пиво и слабоалкогольные напитки", "Растительное масло", "Собственные торговые марки", "Доставка продуктов"],
    "clients": ["Покупатели продуктовых магазинов", "Участники программы лояльности X5 Клуб"],
    "suppliers": ["Производители продуктов питания", "Производители напитков", "Импорт овощей и фруктов", "Логистика и транспорт"],
    "competitors": ["Магнит", "Лента", "ВкусВилл", "Маркетплейсы", "Самокат"],
    "goals": ["Рост выручки быстрее рынка", "Развитие дискаунтеров «Чижик»", "Рост доли цифровых бизнесов"],
    "priorities": ["Собственная логистика", "Цифровые сервисы и реклама", "Контроль издержек"],
    "risks": ["Снижение маржинальности", "Требования маркировки «Честный знак»", "Рост расходов на персонал и логистику", "Конкуренция с маркетплейсами"],
    "investment_plans": ["Расширение сети магазинов", "Развитие X5 Логистики"],
    "keywords": ["маркировка", "Честный знак", "Роспотребнадзор", "продуктовый ритейл"]
  },
  {
    "id": "sber",
    "kind": "real",
    "name": "ПАО Сбербанк",
    "aliases": ["Сбер", "Сбербанк"],
    "source_note": "Профиль составлен командой по открытым источникам (сайт и отчётность банка, СМИ). Это не официальная позиция банка.",
    "description": "Крупнейший банк России: кредитование частных и корпоративных клиентов, ипотека, проектное финансирование застройщиков, платежи и цифровые сервисы (СберБанк Онлайн, СберБизнес, СберИнвестиции). Дивидендная политика — 50% чистой прибыли по МСФО.",
    "industry": "Финансы и банки",
    "subindustries": ["Банковское обслуживание частных клиентов", "Корпоративное кредитование", "Ипотечное кредитование", "Цифровые сервисы"],
    "regions": ["Москва", "Московская область"],
    "products": ["Ипотека", "Кредиты бизнесу", "Проектное финансирование", "Вклады", "Платежи и переводы", "Цифровые активы"],
    "clients": ["Частные клиенты", "Корпоративные клиенты", "Застройщики", "Ипотечные заёмщики"],
    "suppliers": ["Центры обработки данных", "ИТ-инфраструктура"],
    "competitors": ["ВТБ", "Альфа-Банк", "Т-Банк", "Газпромбанк"],
    "goals": ["Рекордная прибыль по итогам 2026 года", "Дивиденды в размере 50% прибыли по МСФО", "Рост цифровых сервисов"],
    "priorities": ["Кибербезопасность и непрерывность работы", "Развитие искусственного интеллекта", "Запуск цифрового депозитария"],
    "risks": ["Кредитный риск застройщиков и корпоративных заёмщиков", "Процентный риск при изменении ключевой ставки", "Атаки на центры обработки данных и ИТ-системы", "Регуляторные требования Банка России"],
    "investment_plans": ["Инфраструктура для операций с цифровыми валютами", "Развитие центров обработки данных"],
    "keywords": ["ключевая ставка", "ипотека", "дивиденды", "цифровой депозитарий", "криптовалюта"]
  },
  {
    "id": "pik",
    "kind": "real",
    "name": "ПИК (ПАО «ПИК-СЗ»)",
    "aliases": ["ПИК", "ПИК-СЗ", "ПИК-Специализированный застройщик"],
    "source_note": "Профиль составлен командой по открытым источникам (сайт и отчётность компании, СМИ). Это не официальная позиция компании.",
    "description": "Один из крупнейших девелоперов России: жильё массового сегмента в Москве, Московской области и ряде регионов, собственное производство и подряд. В октябре 2026 года акционеры одобрили делистинг акций; мажоритарный акционер — «Недвижимые активы».",
    "industry": "Строительство и девелопмент",
    "subindustries": ["Жилая недвижимость", "Жильё комфорт-класса"],
    "regions": ["Москва", "Московская область"],
    "products": ["Квартиры в новостройках", "Новостройки", "Жилые комплексы"],
    "clients": ["Покупатели квартир", "Ипотечные заёмщики", "Семьи с детьми"],
    "suppliers": ["Арматура", "Металлопрокат", "Бетон и стройматериалы", "Подрядчики"],
    "competitors": ["ГК «Самолёт»", "Группа ЛСР", "Эталон", "Донстрой", "ФСК"],
    "goals": ["Сохранить объём продаж", "Снизить долговую нагрузку"],
    "priorities": ["Контроль себестоимости строительства", "Запуск новых проектов в Москве"],
    "risks": ["Высокая ключевая ставка и дорогая ипотека", "Изменения условий семейной ипотеки", "Рост себестоимости строительства", "Долговая нагрузка и проектное финансирование"],
    "investment_plans": ["Новые жилые проекты в Москве и Московской области"],
    "keywords": ["семейная ипотека", "эскроу", "делистинг"]
  },
  {
    "id": "aeroflot",
    "kind": "real",
    "name": "ПАО «Аэрофлот»",
    "aliases": ["Аэрофлот"],
    "source_note": "Профиль составлен командой по открытым источникам (сайт и отчётность компании, СМИ). Это не официальная позиция компании.",
    "description": "Крупнейшая авиагруппа России: авиакомпании «Аэрофлот», «Россия» и «Победа», базовый аэропорт — Шереметьево. За девять месяцев 2026 года группа перевезла 42,2 млн пассажиров.",
    "industry": "Авиаперевозки",
    "subindustries": ["Пассажирские авиаперевозки", "Международные рейсы", "Лоукостер"],
    "regions": ["Москва", "Санкт-Петербург", "Сибирь", "Дальний Восток", "Турция", "Китай", "ОАЭ", "Вьетнам", "Египет"],
    "products": ["Пассажирские авиаперевозки", "Внутренние рейсы", "Международные рейсы", "Грузовые авиаперевозки"],
    "clients": ["Пассажиры", "Корпоративные клиенты", "Туроператоры"],
    "suppliers": ["Авиакеросин", "Техническое обслуживание самолётов", "Запчасти", "Аэропортовые услуги"],
    "competitors": ["S7", "Уральские авиалинии", "ЮТэйр", "Азимут"],
    "goals": ["Сохранить пассажиропоток", "Высокая загрузка кресел", "Рост международных направлений"],
    "priorities": ["Контроль топливных расходов", "Надёжность парка и техобслуживания", "Развитие региональных маршрутов"],
    "risks": ["Рост цен на авиакеросин", "Ограничения работы аэропортов", "Доступность запчастей и техобслуживания", "Снижение спроса на внутренних направлениях"],
    "investment_plans": ["Обновление парка самолётов", "Расширение маршрутной сети"],
    "keywords": ["авиакеросин", "демпфер", "расписание", "маршрут", "Шереметьево"]
  }
]
