[
  {
    "id": "uralmet",
    "name": "АО «Уралмет Индастриз» (демо)",
    "description": "Синтетический горно-металлургический холдинг: 2 комбината на Урале, выпуск 4,2 млн т стали в год, около 30% продаж — экспорт в Китай, Казахстан и Турцию.",
    "industry": "Металлургия",
    "subindustries": ["Сталь и прокат", "Трубная продукция", "Толстолистовой прокат"],
    "regions": ["Свердловская область", "Челябинская область", "Китай", "Казахстан", "Турция"],
    "products": ["Толстолистовой прокат", "Арматура", "Трубы большого диаметра", "Металлопрокат"],
    "clients": ["Трубные заводы", "Строительные холдинги Урала", "Девелоперы", "Машиностроительные предприятия", "Покупатели в Китае"],
    "suppliers": ["Коксующийся уголь (Кузбасс)", "Ферросплавы (Казахстан)", "Металлургическое оборудование (Китай)", "Железнодорожные перевозки"],
    "competitors": ["Сибпрокат", "Волжская сталь"],
    "goals": ["Довести долю экспорта в Азию до 35% к 2028 году", "Снизить себестоимость тонны проката на 8%", "Сократить выбросы CO2 на 20% к 2030 году"],
    "priorities": ["Модернизация прокатного производства", "Диверсификация логистики экспорта", "Углеродная отчётность"],
    "risks": ["Рост железнодорожных тарифов", "Долговая нагрузка с плавающей ставкой", "Зависимость от импортного оборудования", "Укрепление рубля снижает экспортную выручку"],
    "investment_plans": ["Электросталеплавильный цех с дуговой печью, запуск 2028, капекс 38 млрд руб.", "Обновление машин непрерывной разливки"],
    "keywords": ["электродуговая печь", "ключевая ставка", "углеродный", "погранпереход", "тарифы"]
  },
  {
    "id": "nordfarma",
    "name": "ООО «Нордфарма» (демо)",
    "description": "Синтетический производитель дженериков: завод в Калужской области, 140 позиций в портфеле, 60% субстанций закупается в Индии и Китае.",
    "industry": "Фармацевтика",
    "subindustries": ["Дженерики", "Безрецептурные препараты", "Антибиотики"],
    "regions": ["Калужская область", "Московская область", "Индия", "Китай", "Казахстан"],
    "products": ["Парацетамол", "Метформин", "Амоксициллин", "Дженерики", "Безрецептурные препараты"],
    "clients": ["Аптечные сети", "Фармдистрибьюторы", "Государственные закупки", "Больницы"],
    "suppliers": ["Фармацевтические субстанции (Индия)", "Фармацевтические субстанции (Китай)", "Упаковка и стекло"],
    "competitors": ["ГенФарм Восток", "БиоЛайн Фарм"],
    "goals": ["Войти в топ-10 производителей дженериков", "Увеличить долю госзакупок до 40% выручки", "Локализовать производство 5 субстанций"],
    "priorities": ["Импортозамещение субстанций", "Прослеживаемость и маркировка", "Выход на рынки ЕАЭС"],
    "risks": ["Зависимость от импорта субстанций из Индии и Китая", "Регуляторные изменения в маркировке", "Ценовое давление в тендерах"],
    "investment_plans": ["Цех синтеза субстанций в Калужской области, 2027", "Расширение склада готовой продукции"],
    "keywords": ["субстанции", "маркировка", "госзакупки", "дженерики"]
  },
  {
    "id": "sfera",
    "name": "Сеть «Сфера Ритейл» (демо)",
    "description": "Синтетическая продуктовая сеть: 920 магазинов в Центре и Поволжье, собственная доставка продуктов, около 18% ассортимента овощей и фруктов — импорт.",
    "industry": "Розничная торговля",
    "subindustries": ["Продуктовый ритейл", "Онлайн-доставка продуктов"],
    "regions": ["Москва", "Московская область", "Татарстан", "Нижегородская область", "Турция"],
    "products": ["Продукты питания", "Свежие овощи и фрукты", "Собственная торговая марка", "Доставка продуктов"],
    "clients": ["Покупатели в городах Поволжья", "Участники программы лояльности"],
    "suppliers": ["Овощи и фрукты (Турция)", "Агрохолдинги Юга России", "Логистические операторы", "Упаковка"],
    "competitors": ["Корзина Плюс", "Маркетплейсы"],
    "goals": ["Открыть 150 магазинов в Поволжье до 2027 года", "Довести онлайн-продажи до 15% выручки", "Снизить логистические издержки на 5%"],
    "priorities": ["Собственная логистика", "Развитие онлайн-доставки", "Персонализация программы лояльности"],
    "risks": ["Рост закупочных цен на импортные овощи и фрукты", "Конкуренция со стороны маркетплейсов", "Требования к обработке персональных данных"],
    "investment_plans": ["Распределительный центр в Поволжье, 2027", "Рекомендации на основе искусственного интеллекта в приложении"],
    "keywords": ["маркетплейсы", "доставка", "персональные данные", "томаты"]
  }
]
